{
  "schema_version": 1,
  "variant": "custom-1.7b",
  "engine_mode": "trt",
  "engine_dtype": "bf16",
  "submodels": {
    "speaker_encoder": true,
    "speech_tokenizer_codec_fused": false,
    "talker_code2wav_fused": true,
    "speech_tokenizer_encoder": false,
    "talker_unified": false,
    "code2wav": false,
    "tts_orchestrator": true
  },
  "talker": {
    "hidden_size": 2048,
    "num_kv_heads": 8,
    "head_dim": 128,
    "num_layers": 28,
    "vocab_size": 3072
  },
  "code2wav_fused": {
    "num_code2wav_hidden_layers": 8,
    "c2w_state_input_names": [
      "c2w_past_kv_0_k",
      "c2w_past_kv_0_v",
      "c2w_past_kv_1_k",
      "c2w_past_kv_1_v",
      "c2w_past_kv_2_k",
      "c2w_past_kv_2_v",
      "c2w_past_kv_3_k",
      "c2w_past_kv_3_v",
      "c2w_past_kv_4_k",
      "c2w_past_kv_4_v",
      "c2w_past_kv_5_k",
      "c2w_past_kv_5_v",
      "c2w_past_kv_6_k",
      "c2w_past_kv_6_v",
      "c2w_past_kv_7_k",
      "c2w_past_kv_7_v",
      "c2w_conv_state_0",
      "c2w_conv_state_1",
      "c2w_conv_state_2",
      "c2w_conv_state_3",
      "c2w_conv_state_4",
      "c2w_conv_state_5",
      "c2w_conv_state_6",
      "c2w_conv_state_7",
      "c2w_conv_state_8",
      "c2w_conv_state_9",
      "c2w_conv_state_10",
      "c2w_conv_state_11",
      "c2w_conv_state_12",
      "c2w_conv_state_13",
      "c2w_conv_state_14",
      "c2w_conv_state_15",
      "c2w_conv_state_16",
      "c2w_transconv_overlap_0",
      "c2w_transconv_overlap_1",
      "c2w_transconv_overlap_2",
      "c2w_transconv_overlap_3"
    ],
    "c2w_state_output_names": [
      "c2w_present_kv_0_k",
      "c2w_present_kv_0_v",
      "c2w_present_kv_1_k",
      "c2w_present_kv_1_v",
      "c2w_present_kv_2_k",
      "c2w_present_kv_2_v",
      "c2w_present_kv_3_k",
      "c2w_present_kv_3_v",
      "c2w_present_kv_4_k",
      "c2w_present_kv_4_v",
      "c2w_present_kv_5_k",
      "c2w_present_kv_5_v",
      "c2w_present_kv_6_k",
      "c2w_present_kv_6_v",
      "c2w_present_kv_7_k",
      "c2w_present_kv_7_v",
      "c2w_new_conv_state_0",
      "c2w_new_conv_state_1",
      "c2w_new_conv_state_2",
      "c2w_new_conv_state_3",
      "c2w_new_conv_state_4",
      "c2w_new_conv_state_5",
      "c2w_new_conv_state_6",
      "c2w_new_conv_state_7",
      "c2w_new_conv_state_8",
      "c2w_new_conv_state_9",
      "c2w_new_conv_state_10",
      "c2w_new_conv_state_11",
      "c2w_new_conv_state_12",
      "c2w_new_conv_state_13",
      "c2w_new_conv_state_14",
      "c2w_new_conv_state_15",
      "c2w_new_conv_state_16",
      "c2w_new_transconv_overlap_0",
      "c2w_new_transconv_overlap_1",
      "c2w_new_transconv_overlap_2",
      "c2w_new_transconv_overlap_3"
    ],
    "initial_state_shapes": [
      [1, 16, 0, 64],
      [1, 16, 0, 64],
      [1, 16, 0, 64],
      [1, 16, 0, 64],
      [1, 16, 0, 64],
      [1, 16, 0, 64],
      [1, 16, 0, 64],
      [1, 16, 0, 64],
      [1, 16, 0, 64],
      [1, 16, 0, 64],
      [1, 16, 0, 64],
      [1, 16, 0, 64],
      [1, 16, 0, 64],
      [1, 16, 0, 64],
      [1, 16, 0, 64],
      [1, 16, 0, 64],
      [1, 512, 2],
      [1, 1024, 6],
      [1, 1024, 6],
      [1, 1024, 6],
      [1, 768, 6],
      [1, 768, 18],
      [1, 768, 54],
      [1, 384, 6],
      [1, 384, 18],
      [1, 384, 54],
      [1, 192, 6],
      [1, 192, 18],
      [1, 192, 54],
      [1, 96, 6],
      [1, 96, 18],
      [1, 96, 54],
      [1, 96, 6],
      [1, 768, 8],
      [1, 384, 5],
      [1, 192, 4],
      [1, 96, 3]
    ]
  },
  "orchestrator": {
    "tts_model_type": "custom_voice",
    "supported_task_types": "custom_voice",
    "max_decode_steps": "4096",
    "audio_chunk_frames": "25",
    "first_chunk_frames": "4",
    "weights_dir": "/models/tts_orchestrator/1/weights",
    "tokenizer_dir": "/models/tts_orchestrator/1/tokenizer"
  }
}
